{
  "schema_version": "1.0",
  "title": "Training example: evidence and explanatory visuals",
  "mode": "public-explainer",
  "audience": "Technical writers reviewing provenance labels",
  "status": "draft",
  "publication": {
    "approved": false,
    "approved_at": null,
    "destination": null
  },
  "sources": [
    {
      "id": "S-1",
      "title": "Synthetic reviewable state fixture",
      "url": "https://example.invalid/visual-brief-fixtures/reviewable-state",
      "kind": "fixture",
      "captured_at": "2026-07-11T10:30:00+08:00",
      "access_assumptions": ["offline teaching fixture"]
    }
  ],
  "claims": [
    {
      "id": "C-1",
      "kind": "observed",
      "statement": "The synthetic source screen visibly shows Reviewable state.",
      "source_ids": ["S-1"],
      "asset_ids": ["A-1"],
      "boundary": "The fixture does not establish a real-system state."
    },
    {
      "id": "C-2",
      "kind": "illustrative",
      "statement": "The generated diagram explains a relationship between evidence, narrative, and links.",
      "source_ids": [],
      "asset_ids": ["A-2"],
      "boundary": "The generated diagram is not factual evidence."
    }
  ],
  "assets": [
    {
      "id": "A-1",
      "path": "assets/01-reviewable-state.webp",
      "kind": "screenshot",
      "role": "evidence",
      "source_ids": ["S-1"],
      "claim_ids": ["C-1"],
      "inspected": true,
      "operations": ["synthetic-fixture", "crop", "highlight"]
    },
    {
      "id": "A-2",
      "path": "assets/02-evidence-explanation-diagram.webp",
      "kind": "generated",
      "role": "illustration",
      "source_ids": [],
      "claim_ids": ["C-2"],
      "inspected": true,
      "operations": ["generated-synthetic-visual"]
    }
  ],
  "outputs": {
    "deliverable": "deliverable.md",
    "evidence_index": "evidence-index.md",
    "social_drafts": "packages/social-drafts.md"
  }
}
