{
  "schema_version": "1.0",
  "title": "Training example: sync settings evidence reply",
  "mode": "evidence-reply",
  "audience": "Stakeholder reviewing a communication format",
  "status": "draft",
  "publication": {
    "approved": false,
    "approved_at": null,
    "destination": null
  },
  "sources": [
    {
      "id": "S-1",
      "title": "Synthetic sync settings fixture",
      "url": "https://example.invalid/visual-brief-fixtures/sync-settings",
      "kind": "fixture",
      "captured_at": "2026-07-11T10:30:00+08:00",
      "access_assumptions": [
        "offline teaching fixture"
      ]
    }
  ],
  "claims": [
    {
      "id": "C-1",
      "kind": "observed",
      "statement": "The synthetic fixture visibly shows Enabled and a 15-minute interval.",
      "source_ids": [
        "S-1"
      ],
      "asset_ids": [
        "A-1"
      ],
      "boundary": "This fixture does not establish a real product behavior."
    }
  ],
  "assets": [
    {
      "id": "A-1",
      "path": "assets/01-sync-status.webp",
      "kind": "screenshot",
      "role": "evidence",
      "source_ids": [
        "S-1"
      ],
      "claim_ids": [
        "C-1"
      ],
      "inspected": true,
      "operations": [
        "synthetic-fixture",
        "crop",
        "highlight"
      ]
    }
  ],
  "outputs": {
    "deliverable": "deliverable.md",
    "evidence_index": "evidence-index.md",
    "slack_block_kit": "packages/slack-block-kit.json"
  }
}
